UserSymbol,cov,Symbol,Longname,Sector,Longbusinesssummary
AAPL,0.016073754341080524,TMUS,"T-Mobile US, Inc.",Communication Services,"T-Mobile US, Inc., together with its subsidiaries, provides mobile communications services in the United States, Puerto Rico, and the United States Virgin Islands. The company offers voice, messaging, and data services to customers in the postpaid, prepaid, and wholesale and other services. It also provides wireless devices, including smartphones, wearables, tablets, home broadband routers, and other mobile communication devices, as well as wireless devices and accessories; financing through equipment installment plans; reinsurance for device insurance policies and extended warranty contracts; leasing through JUMP! On Demand; and High Speed Internet services. In addition, the company offers services, devices, and accessories under the T-Mobile and Metro by T-Mobile brands through its owned and operated retail stores, T-Mobile app and customer care channels, and its websites. It also sells its devices to dealers and other third-party distributors for resale through independent third-party retail outlets and various third-party websites. The company was founded in 1994 and is headquartered in Bellevue, Washington. T-Mobile US, Inc. operate as a subsidiary Deutsche Telekom AG"
AAPL,0.12838724149312125,DIS,The Walt Disney Company,Communication Services,"The Walt Disney Company operates as an entertainment company worldwide. It operates through three segments: Entertainment, Sports, and Experiences. The company produces and distributes film and television video streaming content under the ABC Television Network, Disney, Freeform, FX, Fox, National Geographic, and Star brand television channels, as well as ABC television stations and A+E television networks; and produces original content under the ABC Signature, Disney Branded Television, FX Productions, Lucasfilm, Marvel, National Geographic Studios, Pixar, Searchlight Pictures, Twentieth Century Studios, 20th Television, and Walt Disney Pictures banners. It also offers direct-to-consumer streaming services through Disney+, Disney+ Hotstar, Hulu, and Star+; sports-related entertainment services through ESPN, ESPN on ABC, ESPN+ DTC, and Star; sale/licensing of film and episodic content to third-party television and VOD services; theatrical, home entertainment, and music distribution services; DVD and Blu-ray discs, electronic home video licenses, and VOD rental services; staging and licensing of live entertainment events; and post-production services. In addition, the company operates theme parks and resorts comprising Walt Disney World Resort, Disneyland Resort, Disneyland Paris, Hong Kong Disneyland Resort, Shanghai Disney Resort, Disney Cruise Line, Disney Vacation Club, National Geographic Expeditions, and Adventures by Disney, as well as Aulani, a Disney resort and spa in Hawaii. It also licenses its intellectual property to a third party for operations of the Tokyo Disney Resort; licenses trade names, characters, visual, literary, and other IP for use on merchandise, published materials, and games; operates a direct-to-home satellite distribution platform; sells branded merchandise through retail, online, and wholesale businesses; and develops and publishes books, comic books, and magazines. The company was founded in 1923 and is based in Burbank, California."
AAPL,0.15147853279075243,META,"Meta Platforms, Inc.",Communication Services,"Meta Platforms, Inc. engages in the development of products that enable people to connect and share with friends and family through mobile devices, personal computers, virtual reality headsets, and wearables worldwide. It operates in two segments, Family of Apps and Reality Labs. The Family of Apps segment offers Facebook, which enables people to share, discuss, discover, and connect with interests; Instagram, a community for sharing photos, videos, and private messages, as well as feed, stories, reels, video, live, and shops; Messenger, a messaging application for people to connect with friends, family, communities, and businesses across platforms and devices through text, audio, and video calls; and WhatsApp, a messaging application that is used by people and businesses to communicate and transact privately. The Reality Labs segment provides augmented and virtual reality related products comprising consumer hardware, software, and content that help people feel connected, anytime, and anywhere. The company was formerly known as Facebook, Inc. and changed its name to Meta Platforms, Inc. in October 2021. The company was incorporated in 2004 and is headquartered in Menlo Park, California"
AAPL,0.1618454889312745,GOOG,Alphabet Inc.,Communication Services,"Alphabet Inc. offers various products and platforms in the United States, Europe, the Middle East, Africa, the Asia-Pacific, Canada, and Latin America. It operates through Google Services, Google Cloud, and Other Bets segments. The Google Services segment provides products and services, including ads, Android, Chrome, devices, Gmail, Google Drive, Google Maps, Google Photos, Google Play, Search, and YouTube. It is also involved in the sale of apps and in-app purchases and digital content in the Google Play and YouTube; and devices, as well as in the provision of YouTube consumer subscription services. The Google Cloud segment offers infrastructure, cybersecurity, databases, analytics, AI, and other services; Google Workspace that include cloud-based communication and collaboration tools for enterprises, such as Gmail, Docs, Drive, Calendar, and Meet; and other services for enterprise customers. The Other Bets segment sells healthcare-related and internet services. The company was incorporated in 1998 and is headquartered in Mountain View, California."
AAPL,0.26460382499963925,CMCSA,Comcast Corporation,Communication Services,"Comcast Corporation operates as a media and technology company worldwide. It operates through Residential Connectivity & Platforms, Business Services Connectivity, Media, Studios, and Theme Parks segments. The Residential Connectivity & Platforms segment provides residential broadband and wireless connectivity services, residential and business video services, sky-branded entertainment television networks, and advertising. The Business Services Connectivity segment offers connectivity services for small business locations, which include broadband, wireline voice, and wireless services, as well as solutions for medium-sized customers and larger enterprises; and small business connectivity services in the United Kingdom. The Media segment operates NBCUniversal's television and streaming business, including national and regional cable networks; the NBC and Telemundo broadcast networks and owned local broadcast television stations; and Peacock, a direct-to-consumer streaming services. It also operates international television networks comprising the Sky Sports networks, as well as other digital properties. The Studios segment operates NBCUniversal and Sky film and television studio production and distribution operations. The Theme Parks segment operates Universal theme parks in Orlando, Florida; Hollywood, California; Osaka, Japan; and Beijing, China. The company also offers a consolidated streaming platforms under the Philadelphia Flyers and the Wells Fargo Center arena in Philadelphia, Pennsylvania; and Xumo. Comcast Corporation was founded in 1963 and is headquartered in Philadelphia, Pennsylvania."
AMZN,0.06378046111041949,TMUS,"T-Mobile US, Inc.",Communication Services,"T-Mobile US, Inc., together with its subsidiaries, provides mobile communications services in the United States, Puerto Rico, and the United States Virgin Islands. The company offers voice, messaging, and data services to customers in the postpaid, prepaid, and wholesale and other services. It also provides wireless devices, including smartphones, wearables, tablets, home broadband routers, and other mobile communication devices, as well as wireless devices and accessories; financing through equipment installment plans; reinsurance for device insurance policies and extended warranty contracts; leasing through JUMP! On Demand; and High Speed Internet services. In addition, the company offers services, devices, and accessories under the T-Mobile and Metro by T-Mobile brands through its owned and operated retail stores, T-Mobile app and customer care channels, and its websites. It also sells its devices to dealers and other third-party distributors for resale through independent third-party retail outlets and various third-party websites. The company was founded in 1994 and is headquartered in Bellevue, Washington. T-Mobile US, Inc. operate as a subsidiary Deutsche Telekom AG"
AMZN,0.15074456445090217,VZ,Verizon Communications Inc.,Communication Services,"Verizon Communications Inc., through its subsidiaries, engages in the provision of communications, technology, information, and entertainment products and services to consumers, businesses, and governmental entities worldwide. It operates in two segments, Verizon Consumer Group (Consumer) and Verizon Business Group (Business). The Consumer segment provides wireless services across the wireless networks in the United States under the Verizon and TracFone brands and through wholesale and other arrangements; and fixed wireless access (FWA) broadband through its wireless networks, as well as related equipment and devices, such as smartphones, tablets, smart watches, and other wireless-enabled connected devices. The segment also offers wireline services in the Mid-Atlantic and Northeastern United States, as well as Washington D.C. through its fiber-optic network, Verizon Fios product portfolio, and a copper-based network. The Business segment provides wireless and wireline communications services and products, including FWA broadband, data, video and conferencing, corporate networking, security and managed network, local and long-distance voice, and network access services to deliver various IoT services and products to businesses, government customers, and wireless and wireline carriers in the United States and internationally. The company was formerly known as Bell Atlantic Corporation and changed its name to Verizon Communications Inc. in June 2000. Verizon Communications Inc. was incorporated in 1983 and is headquartered in New York, New York."
AMZN,0.1516278176497035,T,AT&T Inc.,Communication Services,"AT&T Inc. provides telecommunications and technology services worldwide. The company operates through two segments, Communications and Latin America. The Communications segment offers wireless voice and data communications services; and sells handsets, wireless data cards, wireless computing devices, carrying cases/protective covers, and wireless chargers through its own company-owned stores, agents, and third-party retail stores. It also provides Virtual Private Networks, AT&T Dedicated Internet, Ethernet, data services, cloud solutions, outsourcing, and managed professional services, as well as customer premises equipment for multinational corporations, small and mid-sized businesses, governmental, and wholesale customers. In addition, this segment offers broadband services, including fiber connections, legacy telephony voice communication services, and other VoIP services and equipment to residential customers. This segment markets its communications services and products under the AT&T, AT&T Business, Cricket, AT&T PREPAID, and AT&T Fiber brand names. The Latin America segment provides postpaid and prepaid wireless services in Mexico under the AT&T and Unefon brand names, as well as sells smartphones through its owned stores, agents and third-party retail stores. The company was formerly known as SBC Communications Inc. and changed its name to AT&T Inc. in 2005. AT&T Inc. was incorporated in 1983 and is based in Dallas, Texas."
AMZN,0.15531119357432308,CHTR,"Charter Communications, Inc.",Communication Services,"Charter Communications, Inc. operates as a broadband connectivity and cable operator company serving residential and commercial customers in the United States. The company offers subscription-based internet, video, and mobile and voice services; a suite of broadband connectivity services, including fixed internet, WiFi, and mobile; Advanced WiFi services; Spectrum Security Shield; in-home WiFi, which provides customers with high performance wireless routers and managed WiFi services to enhance their fixed wireless internet experience; out-of-home WiFi; and Spectrum WiFi services. It also offers voice communications services using voice over internet protocol technology; and broadband communications solutions, such as internet access, data networking, fiber connectivity, video entertainment, and business telephone services to cellular towers and office buildings for business and carrier organizations. In addition, the company provides mobile services; video programming, static IP and business WiFi, voice, and e-mail and security services; sells local advertising across various platforms for networks, such as TBS, CNN, and ESPN; sells advertising inventory to local sports and news channels; and offers Audience App to create data-driven linear TV campaigns for local advertisers. Further, the company offers communications products and managed service solutions; data connectivity services to mobile and wireline carriers on a wholesale basis; and owns and operates regional sports networks and news channels. It serves approximately 32 million customers in 41 states. Charter Communications, Inc.was founded in 1993 and is headquartered in Stamford, Connecticut."
AMZN,0.21017113888315933,CMCSA,Comcast Corporation,Communication Services,"Comcast Corporation operates as a media and technology company worldwide. It operates through Residential Connectivity & Platforms, Business Services Connectivity, Media, Studios, and Theme Parks segments. The Residential Connectivity & Platforms segment provides residential broadband and wireless connectivity services, residential and business video services, sky-branded entertainment television networks, and advertising. The Business Services Connectivity segment offers connectivity services for small business locations, which include broadband, wireline voice, and wireless services, as well as solutions for medium-sized customers and larger enterprises; and small business connectivity services in the United Kingdom. The Media segment operates NBCUniversal's television and streaming business, including national and regional cable networks; the NBC and Telemundo broadcast networks and owned local broadcast television stations; and Peacock, a direct-to-consumer streaming services. It also operates international television networks comprising the Sky Sports networks, as well as other digital properties. The Studios segment operates NBCUniversal and Sky film and television studio production and distribution operations. The Theme Parks segment operates Universal theme parks in Orlando, Florida; Hollywood, California; Osaka, Japan; and Beijing, China. The company also offers a consolidated streaming platforms under the Philadelphia Flyers and the Wells Fargo Center arena in Philadelphia, Pennsylvania; and Xumo. Comcast Corporation was founded in 1963 and is headquartered in Philadelphia, Pennsylvania."
JPM,0.04744944703883463,T,AT&T Inc.,Communication Services,"AT&T Inc. provides telecommunications and technology services worldwide. The company operates through two segments, Communications and Latin America. The Communications segment offers wireless voice and data communications services; and sells handsets, wireless data cards, wireless computing devices, carrying cases/protective covers, and wireless chargers through its own company-owned stores, agents, and third-party retail stores. It also provides Virtual Private Networks, AT&T Dedicated Internet, Ethernet, data services, cloud solutions, outsourcing, and managed professional services, as well as customer premises equipment for multinational corporations, small and mid-sized businesses, governmental, and wholesale customers. In addition, this segment offers broadband services, including fiber connections, legacy telephony voice communication services, and other VoIP services and equipment to residential customers. This segment markets its communications services and products under the AT&T, AT&T Business, Cricket, AT&T PREPAID, and AT&T Fiber brand names. The Latin America segment provides postpaid and prepaid wireless services in Mexico under the AT&T and Unefon brand names, as well as sells smartphones through its owned stores, agents and third-party retail stores. The company was formerly known as SBC Communications Inc. and changed its name to AT&T Inc. in 2005. AT&T Inc. was incorporated in 1983 and is based in Dallas, Texas."
JPM,0.11705174690061912,CMCSA,Comcast Corporation,Communication Services,"Comcast Corporation operates as a media and technology company worldwide. It operates through Residential Connectivity & Platforms, Business Services Connectivity, Media, Studios, and Theme Parks segments. The Residential Connectivity & Platforms segment provides residential broadband and wireless connectivity services, residential and business video services, sky-branded entertainment television networks, and advertising. The Business Services Connectivity segment offers connectivity services for small business locations, which include broadband, wireline voice, and wireless services, as well as solutions for medium-sized customers and larger enterprises; and small business connectivity services in the United Kingdom. The Media segment operates NBCUniversal's television and streaming business, including national and regional cable networks; the NBC and Telemundo broadcast networks and owned local broadcast television stations; and Peacock, a direct-to-consumer streaming services. It also operates international television networks comprising the Sky Sports networks, as well as other digital properties. The Studios segment operates NBCUniversal and Sky film and television studio production and distribution operations. The Theme Parks segment operates Universal theme parks in Orlando, Florida; Hollywood, California; Osaka, Japan; and Beijing, China. The company also offers a consolidated streaming platforms under the Philadelphia Flyers and the Wells Fargo Center arena in Philadelphia, Pennsylvania; and Xumo. Comcast Corporation was founded in 1963 and is headquartered in Philadelphia, Pennsylvania."
JPM,0.17181045555234734,META,"Meta Platforms, Inc.",Communication Services,"Meta Platforms, Inc. engages in the development of products that enable people to connect and share with friends and family through mobile devices, personal computers, virtual reality headsets, and wearables worldwide. It operates in two segments, Family of Apps and Reality Labs. The Family of Apps segment offers Facebook, which enables people to share, discuss, discover, and connect with interests; Instagram, a community for sharing photos, videos, and private messages, as well as feed, stories, reels, video, live, and shops; Messenger, a messaging application for people to connect with friends, family, communities, and businesses across platforms and devices through text, audio, and video calls; and WhatsApp, a messaging application that is used by people and businesses to communicate and transact privately. The Reality Labs segment provides augmented and virtual reality related products comprising consumer hardware, software, and content that help people feel connected, anytime, and anywhere. The company was formerly known as Facebook, Inc. and changed its name to Meta Platforms, Inc. in October 2021. The company was incorporated in 2004 and is headquartered in Menlo Park, California"
JPM,0.2669936327318839,VZ,Verizon Communications Inc.,Communication Services,"Verizon Communications Inc., through its subsidiaries, engages in the provision of communications, technology, information, and entertainment products and services to consumers, businesses, and governmental entities worldwide. It operates in two segments, Verizon Consumer Group (Consumer) and Verizon Business Group (Business). The Consumer segment provides wireless services across the wireless networks in the United States under the Verizon and TracFone brands and through wholesale and other arrangements; and fixed wireless access (FWA) broadband through its wireless networks, as well as related equipment and devices, such as smartphones, tablets, smart watches, and other wireless-enabled connected devices. The segment also offers wireline services in the Mid-Atlantic and Northeastern United States, as well as Washington D.C. through its fiber-optic network, Verizon Fios product portfolio, and a copper-based network. The Business segment provides wireless and wireline communications services and products, including FWA broadband, data, video and conferencing, corporate networking, security and managed network, local and long-distance voice, and network access services to deliver various IoT services and products to businesses, government customers, and wireless and wireline carriers in the United States and internationally. The company was formerly known as Bell Atlantic Corporation and changed its name to Verizon Communications Inc. in June 2000. Verizon Communications Inc. was incorporated in 1983 and is headquartered in New York, New York."
JPM,0.27640875692957234,GOOG,Alphabet Inc.,Communication Services,"Alphabet Inc. offers various products and platforms in the United States, Europe, the Middle East, Africa, the Asia-Pacific, Canada, and Latin America. It operates through Google Services, Google Cloud, and Other Bets segments. The Google Services segment provides products and services, including ads, Android, Chrome, devices, Gmail, Google Drive, Google Maps, Google Photos, Google Play, Search, and YouTube. It is also involved in the sale of apps and in-app purchases and digital content in the Google Play and YouTube; and devices, as well as in the provision of YouTube consumer subscription services. The Google Cloud segment offers infrastructure, cybersecurity, databases, analytics, AI, and other services; Google Workspace that include cloud-based communication and collaboration tools for enterprises, such as Gmail, Docs, Drive, Calendar, and Meet; and other services for enterprise customers. The Other Bets segment sells healthcare-related and internet services. The company was incorporated in 1998 and is headquartered in Mountain View, California."
ABBV,0.02617138891343687,VZ,Verizon Communications Inc.,Communication Services,"Verizon Communications Inc., through its subsidiaries, engages in the provision of communications, technology, information, and entertainment products and services to consumers, businesses, and governmental entities worldwide. It operates in two segments, Verizon Consumer Group (Consumer) and Verizon Business Group (Business). The Consumer segment provides wireless services across the wireless networks in the United States under the Verizon and TracFone brands and through wholesale and other arrangements; and fixed wireless access (FWA) broadband through its wireless networks, as well as related equipment and devices, such as smartphones, tablets, smart watches, and other wireless-enabled connected devices. The segment also offers wireline services in the Mid-Atlantic and Northeastern United States, as well as Washington D.C. through its fiber-optic network, Verizon Fios product portfolio, and a copper-based network. The Business segment provides wireless and wireline communications services and products, including FWA broadband, data, video and conferencing, corporate networking, security and managed network, local and long-distance voice, and network access services to deliver various IoT services and products to businesses, government customers, and wireless and wireline carriers in the United States and internationally. The company was formerly known as Bell Atlantic Corporation and changed its name to Verizon Communications Inc. in June 2000. Verizon Communications Inc. was incorporated in 1983 and is headquartered in New York, New York."
ABBV,0.0315227799919143,TMUS,"T-Mobile US, Inc.",Communication Services,"T-Mobile US, Inc., together with its subsidiaries, provides mobile communications services in the United States, Puerto Rico, and the United States Virgin Islands. The company offers voice, messaging, and data services to customers in the postpaid, prepaid, and wholesale and other services. It also provides wireless devices, including smartphones, wearables, tablets, home broadband routers, and other mobile communication devices, as well as wireless devices and accessories; financing through equipment installment plans; reinsurance for device insurance policies and extended warranty contracts; leasing through JUMP! On Demand; and High Speed Internet services. In addition, the company offers services, devices, and accessories under the T-Mobile and Metro by T-Mobile brands through its owned and operated retail stores, T-Mobile app and customer care channels, and its websites. It also sells its devices to dealers and other third-party distributors for resale through independent third-party retail outlets and various third-party websites. The company was founded in 1994 and is headquartered in Bellevue, Washington. T-Mobile US, Inc. operate as a subsidiary Deutsche Telekom AG"
